Text,Emotion
"They just aren’t really practical in a moving vehicle.
With a dial/ button you don’t need to take your eyes of the road",surprise
"Honest question, what did the guy buy for $2 million?
Is it a jpeg screenshot with a token attached to it?",surprise
"Pretty fucking impressive. Ukraine is able to get supplies into most regions of the country per reports, so there is potential for quick turnaround -- IE putting the cash to weapons.",surprise
"My US company is doing up to $2,500 match in donation to Ukraine per person. 

I was happy to contribute.",joy
Man’s a hero. Fuck big ISPs. They (along with nearly every other large company) have been taking advantage of people for too long.,anger
"> A Google spokesperson did confirm to *The Verge* that the current reviews — which were not the ones deleted in last week’s purge — are compliant to Google’s policies, and won’t be removed. 

Good.",joy
Robinhood was my one stop shop for stocks but what they did is bullshit. Robinhood can say goodbye to my account once the day comes to sell my $GME. 💎🤲,anger
My Russian friend admitted that he bought the newest MacBook pro the moment when the invasion news came out because he knew that ruble and sales of international products will be fucked. He was right.,anger
"Twitter has accepted Elon Musk’s offer to purchase the company for $44 billion, the company announced in a press release today. Musk purchased the company at $54.20 a share, the same price named in his initial offer on April 14th.",joy
There needs to be repercussions for false copyright strikes. I understand that youtube won't do it (I know it opens them up to actual legal dispute) but it can't continue the way it is.,anger
When I’m watching a tutorial I usually gauge whether or not it actually works based on the like to dislike ratio. Now I’m actually going to have to watch full videos and potentially waste my time. I guess this would be good for YouTube as it’s higher engagement,disgust
"So it's fairly safe to assume that all this hacking is actually being done by one or more government, right?",anger
"Oh shit, they are busting out WWII tech? Oh Vlad, what were you thinking you big dumb shit gibbon. What you gonna do? Emulate North Korea??",disgust
What if Russian citizens who are ***against*** the invasions wanna speak out against it via social media?,anger
"We need more independent Internet in Russia. People need to know the truth, not the brainwashing shit Putin regulates to them",disgust
Good move.  It will not only create electricity it will lessen water loss from evaporation from the canal.  Both those canals are about 44 miles long so ut will be lots of electricity and lots of saved water.  Amazing for California its actually doing something right.,joy
"The solar panels will provide shade over the canals which reduces evaporation, saves water and helps wildlife by providing vegetation. It’s a plan that conserves both water and provides renewable energy",joy
"As a lawyer, I note that if you are facing expensive litigation and your lawyer walks away, it means you are fucked.",anger
"“Every vendor, from text message services to email providers to our lawyers, all ditched us too, on the same day,” Parler CEO John Matze said in an interview with Fox News on Sunday.”",disgust
"Serious question from the UK guys.... are the numerous people who stormed the Capitol and posted their pictures all over Twitter, Facebook etc.... going to be held accountable?.... all the evidence is there",surprise
"Facebook, way late and clumsily “i cArE toO!”

Edit: this is no way to defend or even excuse Twitter responsibility in allowing their platform  be used to spread trump dangerous rhetoric.",anger
Random platforms he doesn’t even use are banning him now lol. Next we are going to hear he was banned from RuneScape.,sadness
"Lmao. It’s literally owned my Cambridge Analytica.

Edit - Just for clarification it’s owned by virtually the same people. Also meant to type *by",surprise
"Stop calling it a “free speech app”. Historically Parler is harsher on dissenting political views than any of their competitors. Just, ya know, against the “other side”.",anger
Kind of like throwing a life preserver to a dead bloated water-logged corpse at this point....but thanks anyhow.,disgust
"“Ummmm yea… Officer, I’m gonna need to see a copy of your public performance rights license for this track….”",disgust
"Having spent much time around gunfire and rock concerts, muscle cars and IMAX Hans Zimmer, I am a fan of this.

TINITUS LANA!",joy
Frequncy Therapeutics is slept on. They have a novel approach to medicine for restoring hearing. I really hope they persist in spite of being undervalued as a public company.,joy
"> First, let me be very clear -- we have suspended all business in Russia. 

So we can assume no services, no support, no parts. This will hurt large Russian businesses a lot even if it doesn’t affect the average person directly.",anger
"I live near plano. We have been getting 18 mins of power, 12 mins of downtime. Its fucking cold. Its boring as shit. I dont have any signal off wifi. 

Im just playing pokemon and going to drink until I fall asleep. Fun times lol.",sadness
"Sitting here in Dallas waiting for the power to go out again. We’ve been lucky so far with just the one outage while we were asleep, but some people have spent eighteen hours with no electricity in single digit weather. Seriously worried people are going to die tonight.",fear
"If you watch sports indefinite usually means for half of the post season when your team didn’t even make the post season.


So not long.",disgust
"I was permanently banned from Twitter years ago because of an immature account name related to sex. 

This dude encourages a coup and gets a few weeks of an inactive account. It’s absurd.",disgust
">
The NFT was instantly snapped up by an automated account - and put back on sale at nearly $250,000.
  


Lmao free money for the purchaser here.",surprise
"Make. Tesla. Respirators. 

Seriously. Found Tesla Health and just blow Medtronic and GE out of the water.",surprise
Well I’ll give Elon Musk some credit occasionally his bottomless need for attention results in good being done.,anger
They removed approximately 80% of their videos. From around 13mil clips to just around 2.9mil clips.,surprise
"> Apple may have to cough up €60m ($73m, £53m) after Altroconsumo, an Italian consumers rights group, filed a class-action lawsuit railing against Cupertino's practice of throttling the performance of its older smartphones. 

A drop in the ocean for Apple.",anger
"Apple says 60m isn't worth getting out of bed for. Our reputation, now that's worth getting the baseball bats out for.",disgust
"Imagine dudes in the room

Putin: we running out of money for war

Trusted General: let’s extort google",anger
Godspeed to them. The level of depravity these poor people have had to endure for generations is almost unfathomable. Maybe having freer access to media will start to encourage change.,disgust
This should be a basic service IRS provides. Otherwise they shouldn’t expect people to file on time or ever.,anger
"I wonder if people are spending more knowing what the proceeds to to, or if this is close to what they make normally?",surprise
I’m perfectly fine with her living an extremely comfortable life if she wants to spend it giving the money away.,joy
"Seriously absurd how people called her a gold digger when the divorce happened. She was one of the earliest employees and crucial in Amazon’s success

Opinions about Jeff aside, highly recommend The Everything Store book",surprise
"If only there were some kind of system in place, a system which took a small percentage of this wealth and distributed it to pay for social works and infrastructure, rather than leaving it up to the whims of billionaires. Let’s call it a “tax”.",disgust
It's almost like raising prices while simultaneously taking away features during a drought of good content from them was a bad idea.,disgust
All I ever read about when it comes to NFTs seems to be stories of people using them to screw others.,disgust
People will talk about the upside but they will ignore how malfunctions will cause a lot of problems for drivers,anger
"How can I join? They fucked me over, at the current price I would have lost money, but its my fucking money to lose.",anger
"If the ISP receives government funds for infrastructure improvements, they should not be allowed to have data caps.  Nor should the customer be charged a monthly infrastructure improvement fee.",anger
"Dude was talking about heads on spikes and gave names of who he wanted beheaded. How is that ok to anyone? How did that man advise the president in any capacity, ever?",disgust
"You can only pull off the “Beethoven / mad genius” look if you generate works loved or respected by millions. 
  
Absent this, you’re just a crazy homeless guy in the park yelling at squirrels.",surprise
Tl;dr: Court tells Parler to stop bitching about conspiracy nonsense after they repeatedly ignored Amazon's warnings they were breaching the contract by refusing to remove direct incitations to violence,anger
The honey pot is not yet needed. We are going through all the flies we caught at the moment. Please stay on the line and we will get back to you once the need for more terrorist attractions  arises.,fear
I mean Parler can’t be serious...they had to have known Amazon wasn’t going to get caught up in this PR disaster.,surprise
They're smart to shut down the metaverse pipedream before it bankrupted them.  Facebook may not have the same foresight.,surprise
"The way we shouldn't turn to. Why do they need to show us the ads every minute, every step, everywhere?",surprise
"I will never buy a Ford then. Fuck that shit if they run ads in vehicles.

ETA: 
u/ianfabs, u/1koolspud, u/6footsub, u/feebledragon, u/JBMarkets, u/mitarodactyl, u/sphinx502, u/memepalm, u/tway11122, thank you.",anger
"Maybe their current pricing offer is just a trick to make people feel the one planned is reasonable, but at least there is a backlash so it's not too bad.",anger
"What does it mean if they go private? I mean I’m in all the subs I am interested in. Don’t really use popular. 

So does that mean I most likely wouldn’t even notice? If so, should we all just stay off Reddit completely in addition to subs going private?",surprise
"So they want people to leave ship? Gotcha.

Edit: I stand corrected. I merely skimmed over the article and missed that apparantly normal users won't be affected by this as this mentioned above will be a less expensive option but with ads. Good for those willing I suppose.",surprise
Been waiting to update my graphics card to 3060 or 3080. How low do you all think the prices could go?,surprise
"I'm happy to hear the investigating team are OK, there were reports that the local police were providing protection for the call centers. Hopefully, all the criminals are jailed for a long time and not just released to start up again.",joy
"These call centres are well-known, for example to the RCMP in Canada. Raids happen often, they don't seem to do very much good.   The local police are protecting the scammers in many cases.",fear
"“You can’t host parties… but hosts can say that 100 people can stay at their properties.”

This doesn’t ban parties, it makes it so that owners can basically specify if parties are allowed. Which a.) is how it should be, and b.) wasn’t that how it always was anyway?",disgust
"I understand the pricing they have for photoshop and illustrator, but the price they want you to pay just to edit a pdf once a month is absolutely INSANE.",surprise
"Looking at you, Southwest. $8/day is dumb. And add outlets while you’re at it. I don’t care about the cable TV that plays reruns or the shitty selection of TV shows that hasn’t changed in 2 years.",disgust
"Considering that airlines decrease number of olives in martinis and inches of leg room to fit more seats, along with the luggage fees and restrictions and lack of amenities that were once available-good. The least we deserve is some free WiFi.",anger
I have phone calls permanently muted because of this. If something official is going down I better get a certified letter because I will never answer the phone again lol,sadness
">Right before and after the man’s heart stopped beating, for instance, there was an increase in gamma brain waves, which are associated with learning and memory.          

Uploading his experiences into the matrix",surprise
"Read the short story “Bullet in the Brain” by Tobias Wolfe. It is about a man shot in the head during a bank robbery. As the bullet passes through his brain, he relives an afternoon of baseball as a young boy.",disgust
"Corruption in the ranks of unaccountable bureaucrats!?!?!  no way!

So glad that could never happen here....",surprise
I was mildly hoping to see Trump on YouTube one day saying. “Please subscribe to my YouTube channel and hit that like button.”,surprise
I just can never get past that haircut. With all that money ol boy should be able to get himself a barber and put away the flowbee.,surprise
Couldn't have happened to a more deserving soul ..oh wait a minute I think he gave up his soul years ago.,surprise
When did streaming become cable? Like whose brilliant idea was to break the cable industry only to go back to being cable?,surprise
It’s just so painful to see a once great innovative streaming giant floundering and flopping around.  RIP Netflix.,sadness
Clamping down on password sharing doesn’t taste as good today as it did in the boardroom when they came up with the idea to charge extra when their regular monthly fees are already nearly 100% higher than their competition.,disgust
"Does she even have any legal recourse ? Although it’s completely absurd that this can happen, it seems legal because of the deregulation of the energy industry in Texas.",disgust
Don’t pay it. What is Griddy’s recourse? Debt collection? Your not going to jail over a power bill. Fuck em.,anger
"*Speaking to the Financial Times in his first interview since leaving, Chaillan said China is streets ahead of the United States.*

&#x200B;

Someone's a Community fan.",surprise
"It says it cost him $300,000 to build his ISP for his whole neighborhood. I wonder how much it would cost to build a personal ISP?",surprise
"Misinformation, hate, being used to manipulate elections, providing access to user data to questionable parties...

Sounds like TikTok isn't the only app that Pompeo should be talking about banning.",disgust
Because why should you let the customer have full ownership over what they want to do with their devices? God forbid you want to accept the risks and go to a third party repair location,anger
Is this the same shit that’s going on with John Deere? I remember my dad talking about it and if it passes he wanted to open his own shop or something,disgust
China just gonna buy Russia at this point. Putin is about to mortgage them all for an invasion no one asked for. These actions will have consequences for decades after he’s gone.,anger
"I wish I could see more of this, they are the worst kind of human ever always target old people lonely and helpless people",disgust
Maybe I’m just a cynical ass but I just always assumed everything I do online is being tracked and just made peace with that. Never for one second thought otherwise.,anger
"If something is free, YOU are the product. This is the same business model that Facebook et al use stateside.",anger
"I’m trying to post the results of my “Which cruciferous vegetable are you?” quiz and the shit won’t work. Unacceptable.

Edit: I am arugula",disgust
"> trains managers on Indian caste system

In case anyone else thought the title was ambiguous: the training is so that managers can identify and avoid caste-based discrimination.  Apple isn't training managers to respect or conform to the caste system.",surprise
"As others have pointed out in other threads, this is a non-story. 8,000 workers at a tech company, where we can assume the average salary is $100k, is about a billion dollars in savings when including benefits. $10 mil is a drop in the bucket for a company this size.",surprise
"Once my WoW account got hacked. A few days go by and I regained access to it. They leveled up jewelcrafting and mining to max, filled my new huge bags FULL of stacks of metal and gems along with 120k gold. I was stoked lol",joy
"The interviewee asked to be anonymized as YC. The article names him as CEO of Tactical Systems, a French military and defense training firm. Is the journalist trolling him or something?",anger
"I’m tired AF and I read that “Online Sloths” were doing this shit. 

Didn’t even question it. Just, “Damn. They got sloths doing online stuff now.”

Fkn moron",disgust
"They've been saying this since TikTok launched.. ByteDance works with the CCP, why wouldn't they give data?",surprise
I came to the comments to learn and read an interesting conversation. Instead it’s a bunch of jokes about eating the asteroid. What a shit subreddit.,disgust
"Russia state media is on Twitch?? 

What are they playing?? Or is it one of those baby pool channels?",surprise
Just forward all those phone numbers to the “calling about your car’s extended warranty” people and we’ll win the psyops war!,joy
This reminds me of the scene in Inglorious Basterds where the rational of the swastika carvings gets explained. Can’t take off your Russian uniform and just forget the crimes of the past now.,disgust
"Now we can see when the turbine reaches full capacity, emits a frequency that awakes The Kraken and it's mating lust.
Godzilla, on the other side, will watch.",disgust
"For years I've imagined one or more of these underneath the Golden Gate Bridge; so much water passes through that narrow channel each day, who knows how much energy could be produced.",surprise
"I read “lose appeal” as in “consumers don’t find it fashionable” - not a court appeal. 

I suppose both meanings are true since: 1. People are hating on them, and rightfully so and 2. They lost the court appeal.

English is funny.",disgust
"The Prop 22 ads on youtube lately have been really annoying.

Thing is, I don't even live in California.  For some reason, Uber and Lyft are paying to play pro Prop 22 ads in Arizona.",surprise
"Breaking news: government has access to nearly everything electronic that connects to the internet. 

More breaking news: major ISPs and hardware companies all have agreements with government agencies to provide this stuff. It's not really a secret at this point.",surprise
Lidar is a very neat thing. Can’t wait until they start excavating and recording some of the many ancient presumably untouched areas.,joy
The article didn’t mention which 6 companies have been sanctioned nor how they were identified. I suppose they recovered enough of the balloon wreckage to identify key components,sadness
"In 2023, Reddit CEO and corporate piss baby Steve Huffman decided to make Reddit less useful to its users and moderators and the world at large. This comment has been edited in protest to make it less useful to Reddit.",anger
Reddit crashing Wall Street and making it to Super Bowl in the same year. It’s a good time era for Reddit.,joy
"He should call his representative. It’s probably time to upgrade his modem rental or renew his contract, I hear there’s a great deal if you bundle a bunch of bullshit.",disgust
"It's gone. It wasn't even a 3.5 HDD, it was a loose 2.5 laptop HDD. The platters probably shattered when it fell from his bin into the garbage truck.",disgust
"Hello. This is Homer Simpson, a.k.a. Happy Dude. The court has ordered me to call every person in town to apologize for my telemarketing scam. I'm sorry. If you can find it in your heart to forgive me, send one dollar to Sorry Dude 742 Evergreen Terrace, Springfield. You have the power.",sadness
"FYI: in case it’s not obvious, this isn’t the Chapelle show and the dude in the thumbnail is not the white-supremacist in question, but rather Andrew Gillum, former Democratic gubernatorial candidate from Florida.",surprise
"Not surprising.  In other news, Tumblr is allowing some NSFW stuff to come back.  No sex scenes, but nudity.",surprise
"I’ll agree to return to office in exchange for a 4 day, 32 hour work week. Even though I fully believe that having both WFH and a 4 day work week would get the best productivity out of me.",joy
"Another feature I might actually use, unlike pocket. I still to this day do not understand pocket, does anyone use it?",surprise
"I was able to stream some russian tv and translated it. Quote from the broadcaster.

 “Don’t listen to young people they lie”",anger
I mean all people want is there phone screen on the radio. People love Android auto and Apple car play and I get it.,joy
"The headline is poorly worded. Ford continues to support CarPlay (as well as Android Auto), in comparison to competitor GM who dropped support for CarPlay.",disgust
The only metric the article brings up is efficiency. But there’s tons of other variables which helps quantify the usefulness of a “breakthrough”,surprise
"It seems all these ”brave” brands are just pausing their ads on Facebook for a couple of weeks. Once things cool down, they will be back. I have zero faith in brands and advertising.",disgust
"I’m sure you’re all wondering why I’ve called you here. Look around the table. You may see unfamiliar faces, but each of you has something in common: you’re the best of the best. We know because each of you read the secret message on the White House website.  
 
Edit: my sides. Y’all are killin me",surprise
"That's why Ford split EVs from ICE company. They want the profit per unit Tesla is making. 

Dealers are antiquated.",surprise
The dealers are out of control. Ford should franchise service centers and keep sales control out of dealer control .,anger
"About time. Worked for a dealership for 3 years and can’t be happier to see all of them go under. Completely outdated business model, and they dug their own grave through shady bullshit",sadness
I think it’s more fitting if people unfollowed him and he becomes inconsequential. A ban just fuels the trumpets more.,disgust
How are people going to see how his last act as a petulant child play out in public? I’d love for the cameras to be rolling when he tries to sign and his account is banned.,disgust
"""Imagine a business where people hand you money, and you hand them back...... absolutely nothing. Now that's a real American dream.""",anger
"> “Youtube said that no ads will appear on Google Search or YouTube in Russia. Youtube creators won't be able to monetize on content from viewers in Russia, but can still make money from ads and other monetization products shown to users in countries outside of Russia.”",sadness
"What shocks me the most is that nobody is doing a single thing about it.

There’s evidence of data harvesting on minors for malicious intent.
There’s data mining without consent.
But not a damn thing is ever done about it.",surprise
"I received an email yesterday saying they would have cards in stock. Less than an hour later, a second email came saying they were sold out.",surprise
They should find a way to combat GPU scalping in their new online store.. they’d define their share of the market real quick.,surprise
It’s a weird phenomenon but only provides really low voltage power. Might be useful for medical devices or other extremely low power devices.,disgust
Yet after countless pleas they refuse to provide us with fiber in a community where 500 people signed a petition because we have trash ATT dsl. Shameless PR stunt.,disgust
What all I have to do is spend 10k and get better internet. I think that’s a deal. Not joking. I offered to pay for what ever equipment to get faster internet at my house but they would budge.,anger
"That’s all well and good but where the hell is the long range Model 3, the car I actually want to buy? It’s been gone for like 9 months now and still says “coming in 2023”.",surprise
"Yeah it made YouTubers sound extremely stupid too. Like instead of saying “Suicide” they would use terms like “unalive” I miss old YouTube when you can have almost anything you wanted. Also please add back the like and dislike ratio, youtube is trash without it.",disgust
Most editors would just remove sound completely where the profanity was which was a nightmare to listen too. Hope this helps this.,fear
"This makes sense as to why in some videos, creators would say “fuck” and the bleep the same word a few minutes later. 

What a shitload of fuck",disgust
Freaking all the technology in the world and it takes farmers to set us free to fix our own damn stuff. Is this irony?,anger
"Everyone, without age verification, can view a lifetime’s worth of explicit material right here on this very platform",surprise
"Tesla broke laws, Twitter had employees sleeping in office zoned buildings…when do we actually fine these companies for abusing their workers?",anger
">The judge ordered Tesla to cease and desist from violating workers' rights and to post notice of the violations in the service center and email it to employees.

So, no actual punishment. This isn't even a slap on the wrist.",anger
I’m sure his family is getting some nice backend money on that deal. They’re still using his voice technically,joy
Only way this crap will stop is if the fine is far greater than amount of money maid… i.e. if they made 10 billion a fine for 20 billion would stop it real quick.,anger
