Text,Emotion
"One of the only reasons I haven't quit bartending is because I work 32 hours a week with full benefits, a good salary, profit sharing, and 401k.  I could easily ""move up"" in the world but I've realized how meaningless it all is, and I've decided to only work half of the week until I retire.",sadness
"My doctor put me on a 4 day week restriction in Sept. due to my back problems and it has been life changing. Working Mon-Tues, Thurs-Fri has allowed me to get much needed rest and enabled me to actually make it through a full week. I honestly don't know if I could ever go back.",surprise
"“Senator...*we run ads*.”

As if congress would know what to do. Pac-Man is an emerging technology to those doddery old farts.",disgust
"Yang also supports nuclear energy, which is what we need if we want to combat climate change to our fullest abilities.",joy
"Yeah TBH I've noticed that too. We're barely generating any science, just culture. Even Russia's almost caught up.

We need to build a couple campuses.",surprise
"Okay, now the real test. Can you get it shaped like dinosaurs?

Edit: My most popular comment is now about dinosaur-shaped chicken nuggets. I'm quite pleased about that.",joy
"I wonder if the process will eventually be miniaturized so we can grow meat at home. I could see a day where everyone has automated machines that not only grows the meat, but preps it and cooks it as well. The Jetsons future made real.",surprise
"If I'm paid hourly, and they want me to respond to them 24 hours a day... If I'm not paid for my time outside work, I'm not performing work when I'm not being paid.",anger
"Good. We've made absolutely ungodly strides as far as worker efficiency, and never has that resulted in less hours worked.",disgust
"Wait...you can do something without the federal government mandating it?!?

EDIT: That's gold, Jerry!  ^^^Reddit^^^ Gold!",surprise
I love my e-bike for getting around town but here in canada that becomes fairly impossible for a third of the year. I would really just like some top notch public transit to fill in the gaps. Outside of Canadas largest cities public transit here is pretty much F-tier.,joy
This goes to show that media can be used for good. My boys and I are going to plant trees in honor of this. 😁,joy
"“We are a global coalition of Microsoft workers, and we refuse to create technology for warfare and oppression,” ... More than 50 Microsoft employees signed their names to the letter. Microsoft employs almost 135,000 people worldwide.

How is 50/135000 news?",anger
"Isn’t pretty much the entire military computer network run on windows? As I recall Microsoft was being paid hundreds of millions to keep supporting Windows XP while they finally upgraded their network to Windows 10. Sorry employees, you’re pretty late to your protest party.",sadness
"Now, any of your insane ideas and dreams get a bearing. Next step: draw a sketch, get it in real physical 3d reality",anger
"The title is somewhat misleading. There is already a state aid, limited to 2500€, for people switching from a diesel/gasoline car to an electrical vehicle. Now it has been extended to electrical bikes and scooters - but it covers no more than 40% of the price and it is limited to about 1000€",surprise
"War has changed.

It's no longer about nations, ideologies, or ethnicity. It's an endless series of proxy battles, fought by mercenaries and machines.",disgust
"Ya, obviously... Why do you think they're targeting young men with all this conspiracy hypermasculinity bullshit?",surprise
I think everyone is getting a little caught up in the 100x100 mile part. That’s likely  purely so people can visualize scale. It’s big but it’s not so big that it could never happen.,surprise
Can someone cross post this to R/`Australia. Because we got the space and the heat!! But our PM is owned by thE coal industry and Rupert!,surprise
Can’t wait to also see an article tomorrow talking about how the declining birth rate is a “workforce crisis”,joy
"Now that this is at/approaching mass production viability, can the same mechanisms be easily adapted to any sort of rare/exotic meat or are we stuck with just beef?",surprise
"Lab Grown meat is something I'm interested in investing in. Can't find anything publicly traded, but haven't looked in a couple months.",surprise
"They literally changed my life. Well, I changed my life, but they were they key. They showed me the door.",surprise
"Perhaps Black Mirror should remain television, and not reality.

There is apparently a fine line to tread between the progress of technological business problem solving and the exploitation of human rights.",disgust
How long until Facebook threatens to stop offering their service in the EU because this will hamper their ability to make you personalized ads from your data?,fear
"So when can I buy it how does it taste, and what will it cost?  Do people just pump out articles like this every month with no new information?",surprise
I'm 63 years old now so I don't know if I'll live to see this but in the future the kids growing up now will be able to tell their grandkids they used to eat the flesh of animals that were butchered for food.,disgust
It's a great idea to solve a myriad of issues  but the lobbyist for the large food animal production farms will not make the introduction of lab grown meat to the masses easy.,joy
"The headline makes it sound like you pour saltwater onto some membrane cloth and freshwater trickles through it. That would be world changing. The details sound much more complicated, though.",disgust
"Every time I read about these breakthroughs that would be world-changing if as simple as described, and I wait for, ""the membrane is made out of a combination of rhino horn, Canadian tar sands, and chlorofluorocarbons.""",surprise
The Chinese government announced last month that residents applying for a new mobile or internet device will have their faces scanned by telecommunications carriers. The new rules will apply from December 1.,surprise
"”Health care is vital to all of us some of the time, but public health is vital to all of us all of the time.”—Former Surgeon General C. Everett Koop",fear
In the future there will be a divorce because a man used VR to hook up with a woman that is not his wife.,disgust
Jack sees all the bots on his platform and knows it's just a matter of time until automation replaces most of us,surprise
"Is it just me or does the English speaking media use the word ""war"" very liberally and as often as possible? There is rarely a day on reddit where I don't read about a ""war on something"". 

-edit- wow, this certainly blew up overnight",surprise
"But what's the difference between a robot, an anlgorithm and let's say a loom? This taxation could have been done at any given time...

edit: reading the comments I really doubt taxation will be the solution, sry Bill :D",surprise
"I'd be interested to see how long the 35 year old continues to live....

That's already pretty crazy for a rodent...but to think it could live much longer?",surprise
"Would like to clarify our PM does not accept climate science, it's not that they have been unable to pass climate policy, they are actively preventing progress.",sadness
Horrible title. It implies an attempt has been made to pass any policy relating to climate change. Spoiler: there hasn't.,fear
"*TikTok's parent company, ByteDance, released the results of an internal investigation. Four employees in China scooped up the data of two TikTok accounts belonging to U.S. journalists. The report is emboldening high-profile enemies of TikTok like Missouri Senator Josh Hawley.*",disgust
We've been getting positive results from these trials for years now. Which country is going to take the lead and finally make the 4 day work week the standard?,surprise
"2/3 of voters agree that (objectively good thing) is important. 

No one debates that it's important. People debate the urgency.",disgust
">Ben Hellerstein, state director for Environment Massachusetts, said the bill “sends a clear message to officials in DC"" as a new Presidential administration heads into the White House.

Unfortunately, those DC officials aren't answering the phone.",sadness
"This is the thing I'm optimistic about with Trump, smaller groups banding together to FORCE change we need to be working towards.",joy
"Three billionaires are heading space initiatives. Only one is actually making real progress with a real, useful goal at the end, but that's not the point. That leaves 2,752 billionaires to ""save the world""and they've had decades to work on it.",surprise
Didn't Jamie Oliver try to fix classrooms lunches in LA and got shut down fast because of stupid regulation and greedy corporation contracts?,anger
Why can't the government just use the taxes we already give it to combat climate change instead of... combating everything/one else?,anger
"Yes, this would be the best thing since sliced bread. Elsevier and cronies have a monopoly on well reviewed literature and this is a crying shame. Science, especially paid for with public funds, should be public property. 

&#x200B;

And if this fails? Well, we'll always have sci-hub.",disgust
So so good if this really happens. I advocate for this since years - A world where the real sources are publicly accessible!,joy
"So I lived in hawaii when the plastic bag ban went into effect and it was barely noticeable. Cheap plastic disposable bags just got replaced by cheap plastic ""reusable"" bags.",disgust
They really should look at their styrofoam usage while they are at it. The stuff is EVERYWHERE there.,disgust
We try to prevent a single point of failure when we design our systems. Should be the same with supply chain.,disgust
"You hear something like this every few years. I hope it actually happens this time. I remember they were talking about using those worms to eat it, but then it turned out in nature they eat beehives so if we released a lot of them they could decimate the bee population.",surprise
It's because InGen is getting down to business on Jurassic Park. They need all the fossils they can get. /s,surprise
"Norwegian busdriver here. I work 4 days week, 3 off. Almost 10hours day. Making almost 50k $ a year. 
Got lots of free time to be with the kids or just play games on my pc.",joy
"Fuck I wish this was standard in Canada. I'm sick of this big dick swinging workaholic culture. I probably have it worse than most people (my fault), I don't know the last time I worked less than a 12 hour shift. My body hates me",disgust
"Be interesting if it could actually work, from what I understand there are some very very narrow places.  Believe I even read some the divers have to remove gear to get through.  Risky situation to test something in though.",fear
So... billionaire astronaut uses high-tech submarine to rescue kids trapped in cave. All that's missing is a secret island and the south Pacific and we've got ourselves International Rescue. Thunderbirds are go!,surprise
I literally couldn't have written either my bachelor or master thesis without sci-hub. Uni account gave me access to certain sites/journals but 50+% of stuff I ended up using was still behind a paywall. Shit's just stupid.,disgust
"I remember reading about the idea of doing this when I was in grade school 20+ years ago in popular science magazine. 

Weird that we haven't really gotten that far with it in that time.",disgust
Gravity is so powerful It physically moves the entire ocean. Finding a way to harness that will be useful.,disgust
I don’t think the average joe has quite caught on to what a complete game changer mRNA vaccines are.,surprise
"During my college years, he invited me to a lecture roundtable. He discussed their decision to switch to organic dyes, the great effort they put into ensuring that they hired from the local community, and the trade-offs they make between profit and becoming a more environmentally friendly business.",joy
"So does this mean I should be buying Patagonia products? I'll do it. Don't tempt me.

Edit: to clarify one thing for a couple of responses, I don't own anything Patagonia at the moment. Definitely going to look into some stuff. Sounds like their warranty is pretty dope though.",fear
"Do you think those ""age yourself"" or ""which celebrity do you look like"" apps are contributing to this as well?",surprise
The fact that San Fran has banned its use should raise everyone’s eyebrows. A city that’s arguably the most tech advanced and probably on the cutting edge of technology feel the need to ban it outright might signal that they know how invasive this technology is,anger
"“A new scientific truth does not triumph by convincing its opponents and making them see the light, but rather because its opponents eventually die, and a new generation grows up that is familiar with it.” - Max Planck",disgust
Research has found that Generation Z and Millennials are outnumbered by an ageing population and governments don't give a shit what they think. /s (but not really),surprise
"Getting paid to discard spoil, while making a quality product for cheap.  This is extremely smart.

Hopefully we'll see some specs on the bricks soon.",joy
"All these people shifting responsibility because ""I use gasoline too""! Did you also spend billions suppressing and reframing scientific studies so you can continue dominating the energy industry and erode the planets climate?",anger
"Burning fossil fuels was and is necessary for human progress. Now that the technology exists to produce energy in a cleaner way, we should move in that direction. Until those new methods have been relatively perfected, fossil fuels are still needed. Also, stop the demonization of nuclear power.",disgust
"Finally, we can have true-to-life movies where the detectives get to watch security footage with eagle eyes.

"" Computer... ENHANCE! """,joy
"Fun fact: if it weren’t for France’s coal industry in the 19th century, prehistoric archaeology would not have developed the way it did. French miners were the first to discover buried stone tools, extinct animals, and hominid fossils buried underground.",disgust
">France only produces around 1 per cent of its energy from coal-fired stations

It's going to be tough to close the probably one coal power plant by 2021, but somehow they'll manage",sadness
"Unless I'm mistaken or misunderstand what the author means by ""published"", this article is inaccurate. Yang has had the data as property proposal on his campaign website, and mentioned in some interviews etc; for some time now.",disgust
"I thought this meant automatic weapons instead of self-directed war machines and I was utterly baffled for a few moments.

Yeah, AI death robots are probably a slope we don't want to start sliding on.",surprise
This is literally just proposing higher taxes for the rich it's not some new idea why is it on this sub?,surprise
It seems odd to compare the top five companies combined from one industry to one company of another with the intent to imply one industry is just as bad or worse than the other,disgust
"""California will now be the only government in the world that mandates zero-emission vehicles. It is unique.""

What? The UK will ban it in 2030 and the EU by 2035. What do they mean ""unique""?",surprise
"It doesn't appear that this includes storage for nights and cloudy days. It's very, very cool that building new solar is cheaper than *operating* a coal plant on sunny days—a great step forward—but without storage, it's really not a fair comparison.",surprise
"Genuine question: Isn’t the problem the batteries? We can produce a lot of solar energy, but storing it is not yet optimized. How long do the batteries last? How do we dispose of the batteries?",disgust
"The author of this article doesn't seem to understand the difference between a bit and a byte. 1 petaBIT is 125,000 times faster than a gigaBYTE, not 1 million. It's still an impressive feat, but it's not as impressive as the article tries to make it seem.",surprise
My ISP is going to have a talk with the Japanese. They hit their data limit one second after logging on...,surprise
"Even with the huge field of Democrat candidates in 2019, only two supported Nuclear Power (Andrew Yang and Pete Buttigieg). Hardly seems true that it's becoming more acceptable.",surprise
"Being born in Georgetown and living here for almost 30 years, it is great to see one of the most conservative cities in the state do something like this. Thanks to Dale Ross, Georgetown is currently the largest city in Texas that is run on completely renewable energy.",joy
"""No such animal as clean coal""

Imagining a big hat wearing leather boot strapped red tie and poppy sporting wise man saying such.

This is the America I dream about.",disgust
"Good for him. 

Texas really isn't as off the rails as many non-Texans think. Especially in that part of the state. 

Edit - the word is 'off'",disgust
Was there an extensive list of the banned companies? I wonder if DJI the drone maker is included as well.,surprise
"The article discusses the Semiconductor Chip shortage, and quotes companies blaming COVID, but I thought the shortage was ramping up *before* COVID? Correct me if I’m wrong, I’m not super familiar with the industry",surprise
"""Better be careful, Americans! Maybe we'll make it illegal for the Chinese to invest in American companies!""

""Promise?""",anger
"Ok so it says it changed the US policy and allows collection of biometric data under US law. Do any of you know if this is something they're doing to other countries as well, or is it strictly the US?",surprise
"This shit needs to be illegal, if I walk into a store nobody would ask for my fingerprints, voiceprints, address, contacts, photos, etc.. so why the fuck should apps and websites be different?",anger
How much of it will be in undeveloped parts of the world? will they be allowed to expand into parts of the developed world if there's less in the developed world?,surprise
It feel like half of the people complain that robots will take our jobs and the other half complain that we won't have enough workers.,anger
Remember when the plague took out so many Europeans that the whole system collapsed and peasants were finally valued and had rights?,disgust
His world ranking in net worth is #281 iirc; just imagine if the other 280 wealthier than he is would do the same.,surprise
I can't even comprehend what it must be like to have so much money that you can afford to donate 1 billion dollars.,surprise
"A remarkable technical feat of which the image is the least interesting thing. The data, though, will show up all manner of things about spacetime, Lorentz invariance and similar fundamental.",surprise
"Dumb question, but is that literally exactly what can be seen with the naked eye, or is there some artistic interpretation, added colours etc.?",disgust
"All that complicated and expensive cooling pays off. 

Looking at Nissan leaf data. The midsize battery degrades the least, and the later large batteries degrade the worst.",disgust
"If the U.S. doesn't start pushing for electric cars, they're going to find themselves behind globally when other countries start to ban fuel-burning vehicles.",disgust
">China has rolled out rules that basically nix investment in new fossil-fuel car factories starting Jan. 10

Love it.  Less fossil fuel cars please.",joy
China is really good at creating goals and following through with them. I wish the US could do the same but it’s kind of impossible when every 4-8 years the country shifts positions on nearly everything.,surprise
Even when it's raining or snowing? Honest question: How are they doing with that problem? Is it resolved?,anger
"True of a lot of stuff. We spend money like water in order to keep having a problem we could solve with the same amount of money. The amount the US spent in the middle east, ensuring ""stability"" for our oil supply, could have carpeted the country in renewables.",disgust
"throughout history, labor shortages tend to be when the middle/lower class sees the biggest rises of standard of living/income levels.  when theres labor shortages it puts pressure on companies to raise wages to get enough employees.",sadness
"After adoption, in 10 years time some CEO goes: ""Imagine how much we could improve profits if everyone worked FIVE days instead of four.""",surprise
"I work a 3 day shift in a warehouse as an operations manager and I love it. Yes I work about 3 / 12-14 hours days, but the 4 days off are supreme and I absolutely love my schedule. I doubt I could ever go back to a regular work schedule",joy
"Just a short note that is not obvious from the title: This was only true on that specific day (April 30).

Still a nice achievement and I wouldn't have thought we (Germans) would be anywhere near reaching this!

Edit: Thanks for pointing out the obvious misreading! April 30, not May 1. Sorry.",sadness
"Tell me: Which harmful technology has been banned if those in power thought it was useful?  


It was too late to ban this one long before it was invented.",anger
"Everybody says schools should teach teh wonderful thing that is special to them.

They 're not WRONG - but they never say what to get rid of.",anger
"There are only so many hours in a school day.  People seem to want schools to teach everything from stock trading and tax filing, to meditation and coding.  At a certain point one has to take the basic education they've received and use it to learn about other areas of interest on their own.",surprise
I hope this cascades down into the cellphone market. Because Canadian cell phone plans are 3rd world.,surprise
Even the 23% fit to serve would likely end up leaving the military with one or more of those problems as well,sadness
"Wow it's just government buildings if it had included the casinos we would be talking about something interesting.  
On second thought there are alot of jails so maybe that is quite a feat.",surprise
"TIL the hoover dam which is 30 miles away hasn't been supplying Las Vegas with energy

>By the end of 2017, the city will for the first time begin drawing power from the Hoover Dam, which will complement existing renewable sources.",surprise
"Tangetially related question: between SpaceX, Boeing, NASA, and any other group trying to get a permanent base on some other body, who is most likely to be first, and when?",surprise
"When I visited Germany last summer, this exact ticket was 9 euro as sort of a fuel subsidy. Honestly blew my mind",surprise
"Yeah but the bill also has it mandated where the power comes from company wise, and that tax money goes to out of state energy companies. So while it sounds good in theory someone's pockets are still getting unfairly filled at the cost to Arizona citizens.",anger
"""The concentration of cells is mixed with a nutritious liquid called bio-ink and is then 3D printed into the desired shape.""",disgust
"Do they put the mercury back in for you or do you need to add your own if you like the way the mercury tastes?

Edit: I am always surprised what gets upvoted. This is such a dumb comment. But I’m glad you liked it. :)",surprise
"But what if, instead of having all those things, you took all that money and made a fighter plane that isn't very good?",surprise
"This is already in effect in Budapest, Hungary.
Hybrids and zero-emission cars get the green plate and get to park everywhere for free. I think it's a great incentive and I've seen more and more green plates over the last couple of months.",joy
">In the U.S. this winter, the flu essentially disappeared, causing only a single reported pediatric death (most seasons kill 100 to 200 kids).

Flu only has an normal R of about 1.5. It doesn't take much in the way of social distancing to cut it right back to under 1 and kill an outbreak.",sadness
"It seems obvious that Corona is harder to control than the Flu.

But I wonder if the combination of vaccines plus social distancing and mask during flu season could also kill off most Corona strains.",surprise
"Correct my ignorance because I'm no energy expert, but how are we going to use this energy on a mass, impactful scale if the entire planet is retrofitted to burn fossil fuels? How do we incentivize that conversion?",anger
Yes! I was worried that the broken net neutrality would just fade into the background and people would just accept it.,fear
"I think rather than JUST restoring it, make it a permanent rule that requires 60% of the senate to change.",anger
"Reminds me of the George Carlin line that goes along the lines if “... The planet is fine... but the people, the people are fucked!” About climate change",anger
"""**Azlocillin**...have patented the compound for the treatment of Lyme disease and are  working with a company **to develop an oral form** of the drug. Researchers  plan to conduct a clinical trial.""",joy
"When lab grown meat hits the shelves together with impossible beef, beef made from cows will have some significant competition",disgust
"From my understanding it's cheaper and more efficient to grow plants then raise cows right? So at some point we should expect impossible meat to be cheaper then real meat, yes? Cause right now the price difference is killing me.",disgust
"There was a documentary made about 20 years ago called *Who Killed the Electric Car?* One of the big takeaways was that the GM dealer network thought that they would lose a fortune in maintenance business, so they were very resistant to it.",surprise
Shouldn't it be possible to easily quantify the amount of pollution removed by examining how much is stuck to the filters?,disgust
"It's so cool that they actually built it. When Triton started looking for a buyer for this ~10 years ago, I was skeptical that they'd be able to pull it off. A full ocean depth capable sub is now commercially available.",surprise
