Text,Emotion
Take down their military communications systems next.,neutral
I sincerely hope this is true.,neutral
"Important to note that this is not going to hinder the Russian military except in the dissemination of propaganda to the Russian public. To quote Randall Munroe, Anonymous basically tore down a poster that the Kremlin put up. Here's hoping Anonymous can do some real damage before it's too late and before the news cycle moves on",neutral
Wish I could upvote anonymous,sadness
God bless Anonymous.,neutral
