Text,Emotion
"I've seen a cluster of them before, commenting on China's media page on Facebook. The only issue is that all the accounts are created around the same time. They were all only a couple weeks old.",surprise
"Often, when I openly criticise Trump on FB I get friend invitations by cheap whore-ish fake accounts too...",anger
"*Pushes buttons angrily*

I’m now telling the computer EXACTLY what it can do with a lifetime supply of chocolate...",anger
"I have very little knowledge on simulation theory but would this add into that being plausible?

From my understanding this beast will be able to do that or set the path to be able to simulate a universe

I’d love for someone to help me understand the long term goals of this",surprise
"I appreciate the options I have on HBO Max, but there are just so many issues with it, like downloads not working, or the entire service just straight up not loading anything.",sadness
Now if they can program a Tesla to do it to itself it could be fully autonomous and can just drive off without the owners permission and just cruise around doing its own thing like checking out other cars at the local car dealership,surprise
"No shit Sherlock. First it was the gas, then the meat. Next it’ll be banks then electrical grids. Then they’ll attack our food transport etc...

All while democracy is being destroyed and voter suppression thrives. Hell of a time to be alive...",disgust
So when does the class action lawsuit begin?  Is this going to get cross posted in r/legal?  some lawyer is going to make a fortune...,surprise
"“The company said that nearly 24,000 active accounts had been deleted, along with another 150,000 smaller amplifier accounts.”",sadness
There any indicators on why Microsoft is growing? I’m guessing it has something to do with Azure receiving more use.,surprise
"I speak from ignorance; it seems like a good idea to let any group be online and just monitor what they do and do 'behind the scenes' arrests. It's like having involuntary informants. Some people seem to upload evidence against themselves freely on social media. 

Boggles my mind, but there you go.",disgust
Thank god our technocratic overloads are there to tell us what is real and fake! It’s double plus good that they let us know who the subversive member of our society are so we can all shun them! Thank god for Twitter and Facebook knowing what’s best for us!,anger
"They should put an option to get the charger for free if they care so much about the environment, and it's definitely not about the money",disgust
"The same Ai that constantly bans me for making jokes or quoting comic books? Yeah, what could possibly go wrong…?",surprise
I think in europe they must inform people by law. But i am not sure about this. At least they have to inform the authorities about the data leak.,disgust
His childhood home in Pescadero was an Air B&B that I booked often when going home to see fam. Pretty humble beginning considering what he accomplished.,joy
"Because he showed betas that weren’t public. That will do it every time.

He likely signed a “don’t speak to the media” clause and YouTube is definitely media.",surprise
honestly with any kind of job like that it should be common sense to not do this. i guarantee you this kind of thing was addressed in his business conduct trainings so the grounds for firing are 100% justifiable from a legal standpoint,anger
Not surprised. I can get fired for just posting pics of the inside of my workplace. A grocery store.,surprise
"How would this work? It says telecoms companies could generate revenue from this,but how? Seems like if you build one of these things I to your kit then that's it. It's getting the energy,no way to know who took it",surprise
It really makes you wonder how much money is made off of your personal information without you seeing a dime.,surprise
"I think it’s bullshit that a person can look you up and see your name address and phone number who your parents are your siblings and children are , it’s a criminal wet dream really , extremely dangerous",anger
"Such data access “could, in the wrong hands, spell disaster,” said the lawsuit brought by the Alliance for Automotive Innovation — a trade group backed by Ford, General Motors, Toyota and other big automakers, including Subaru and Kia.",fear
I would think the opposite would be true. Above ground cables/infrastructure would see the worst of it. Undersea cables are shielded by a mile of sea water.,disgust
"Nope, that is just the walls. The real bits that make it a house, like roof and fittings, etc still take days. Good youtube video explain the full story posted on reddit before.",surprise
I honestly thought that the Apple content I “bought” would be available forever. I thought you owned a digital copy you would be able to access at all times somehow. Wow!,surprise
"how the fuck did that egotistical scumbag not resign? he doubled down and said people don’t understand how important the environment is to him, but he told a woman he would kill her? this dude deserves to be muzzled.",anger
"It's 1000 now, and they signed their name and title, so it's not anonymous. That's 10% if their workforce so far. Pretty big deal. I think this is going to snowball. With so many on it now, more people who were afraid of repercussions might sign on.",fear
"Wow. 

I’d say Apple will patch the issue pretty quickly, but that’s nevertheless an amazing jailbreak!",surprise
It’s a race? I’ve long assumed the US has regularly been left behind by other countries when it comes to things like telecom data speeds for phones and internet. while consumers get f’d in the a with price gouging for shitty service,disgust
"“China is also ahead of America in high-tech manufacturing, green energy and many applications of artificial intelligence”

By all means we better figure out 5G before China because we have nothing else to worry about…

/s",fear
"Someone is going to make the 'metaverse' someday, they're going to do it right and it's going to be wildly popular.  That person will not be Mark Zuckerberg.",surprise
"Between this and underpaying it’s workers $173m, how is this business still able to operate in Australia?",surprise
"I am imagining the grant committee discussion:
GM: “Professor Debajit Saha, how would controlling locust using electrodes benefit the human kind?”
DS:” Cancer! We can diagnose cancer with swarms of cyborg locusts!”
GM:”Sounds intuitive! Let’s give you money”.

The End.",surprise
I really hope Starlink provides a real alternative for Americans suffering from a single choice of ISP.  It’s more of an issue than we realize.,joy
"“West of Dallas, Texas”

Is this a fucking joke? Haha. It’s clear on the other fucking side of the state.",disgust
"Verily is. Another subsidiary of Alphabet, which the non techie public wouldn't identify with, so he just said Google.",surprise
China has been doing this for the past two years. It’s their way of mitigating Covid. It’s horrible of course. Watch todays video from cnbc international on YouTube. It goes into a bit.,disgust
"Isn't this normal in China? Not that it's a good thing, but I'm pretty sure there's a documentary on workers in China sleeping at work...",disgust
"Lets keep this trend going of phasing out chinese tech and goods for other countries that could use the wealth, to include our own",joy
"Looking at Dell stock shortages, I’d argue that the Chinese chips have already phased themselves out. They’ve just not found an alternative yet.",surprise
I’m just hoping that in rural areas a little competition comes back. Only having one provider that charges outrageous prices because there aren’t any other options is getting old...,surprise
Haven’t  they already done this before and the big telecom corporations took the money and pocketed it? Whats to stop it from happening a second time?,surprise
"I’m curious as to what the map of the Hawaiian islands looks like. 

I’ve seen maps drawn up by service providers. 

Verizon is definitely full of shit with their maps of Maui, you either get one bar or no service a as all, even in the heavily populated areas and neighborhoods.",surprise
"Ah takes me back to the family PC, 300 MHz pentium, cost about 3 grand! We ate off the box it came in for about 3 months when our house was getting renovated too.",surprise
"In no world should it be possible to spend $64,000 on micro transactions for a single game. This is straight up criminal.",anger
"Gotta love how “beating China” is more of a motivator than “making America a better and stronger country”

Our politicians are children.",joy
I can’t believe so many people don’t know about this. I remember it being such a big deal back in 2016. Anyways fuck you Ajit Pie you piece of shit,surprise
So it keeps the Bitcoin in a massive building where you need a forklift to access the different coins from their various cubbyholes?,surprise
"“IF I STAND HERE WITH MY IPHONE AND MOVE OVER THERE BY THE DEMOCRATS, DOES GOOGLE KNOW WHERE IM GOING?!” 
    
I’m excited to see how this one will inevitably turn out.",surprise
"“My grandson tried connecting to Google and it said ‘unable to connect’, are you denying him service?”",anger
"I’ll be interested to hear how EV startups like Rivian, Nikola, and Lordstown accomplish a service network or who they partner with to make that magic happen.",surprise
Grubhub is trash. Took an hour and a half to get a fast food delivery when I was sick and the food was cold. They only reimbursed me with a food credit,disgust
People were demanding an arrest the day the news broke but it takes time to investigate and determine what charges are appropriate,anger
"He was also carrying pumpkins while faintly heard screaming, “I’ll get you, Spider-Man!!!”, but I’m sure someone will report on that later.",fear
"Tl;dr: Using stars’ gravity to focus radio waves could increase bandwidth of communications over long distances (Kbps between star systems). But obviously, those communications are still limited to the speed of light",surprise
"Not just the elderly. One of my kids is HFA and suffers from anxiety that manifests in hoarding behaviors.

Having something that can put things away and remember where things are while also discarding the actual trash would be huge.",fear
">When freedom is outlawed, only outlaws will be free.

-Tom Robbins

I'll just leave my mobile tracking device at home.",anger
"This is the real 5G theory. Not that it caused corona, but that the pandemic that is corona is going to usher a new wave of surveillance that is centered around 5G.",fear
This reminds me of the time when you could ask Alexa “What is r/wallstreetbets?” and it would respond with “A gathering of homosexuals”.,surprise
"This is what happens when you let the internet crowd teach your AI.  I don’t know how many times it has to be proven, Garbage in, garbage out.",disgust
"This isn't new, they do this to purify water. You can't just shine a LED at your body and kill viruses though",disgust
"(KSTAR) broke one record for fusion, it's smashed it again, this time holding onto a churning whirlpool of 100 million degree plasma for a whole 30 seconds.

1 click less...",surprise
"My favorite is when I get flagged for copyright infringement for using stock audio that I purchased. Google does a great job of making the appeals process smooth and transparent. 


/s",joy
"The DMCA was written before almost any social media website

Writes the forms require moderation, but YouTube is infinite, therefore they must moderate with ~~boats~~ bots, which are filled with error",sadness
"This is a must for flat-earthers, right? Or would many consider this to be another elaborate/ridiculous hoax by the government again?",fear
Gurantee this is an arm twist by the Government after Apple said they’d pull their services from the UK if the Government passes the ‘online safety bill’. A bill that will  allow the police and the government to access all our messages and interactions without our permission or the tech services,fear
"A man is donating a Billion and all people can do is complain and say they don’t like his websites and say it’s not enough. 
Good on him. Hope this starts a trend among others",joy
"slightly unrelated, but why is this linking to an article rather than linking to the source statement of commitment by Apple?

all the article can do is provide a clickbaity headline",surprise
Can teach cows to use a toilet and 3/4 of the shoppers at WalMart still wear their masks below their nose or chin.,disgust
"I don’t understand why people are so opposed to this, yeah if you have a plan to decrease beef consumption then great, meanwhile we also have this which works toward reducing emissions so why not ?",surprise
"Scroll to page 2 and 3, always. Then check eBay.  
I've been Prime for years now, but man there's a lot of junk being sold as premium.",surprise
I will say Amazon is probably one of the worst sites to search. you get results but to find the best deals it takes a lot of effort. really hate how i cant filter easy just product shipped and sold by amazon.,disgust
Apple will now be the world’s largest manufacturer of cameras … which just so happen to also make phone calls.,surprise
I was just reached by Amazon for a product role. I’m declining to interview after hearing these news. Screw it.,anger
Do they really think gangs of starving homeless are just gonna smile and wave as these things roll by?,disgust
"This is a very misleading headline. The SEC chair said that some proof-of-stake systems may be securities. He didn't specifically reference Ethereum or the Merge.

Also, *all* crypto prices are slumping pretty severely right now, not just Ethereum's.",disgust
"It's fortunate that Ethereum isn't considered a security yet, or this type of behavior could be seen as illegal market manipulation.",disgust
Problem is that antibodies are proteins that are fairly temperature sensitive.  Condoms would need to be kept in the fridge...giving new meaning to Netflix and chill.,surprise
"Yes , because I always casually check my penis when being 5 inches deep in some hoe i picked up at the club",disgust
"Good. Maybe I can finally rid myself of these horrible ISPs I can choose from. Hey, at least I’ve got a choice. Most people I know don’t have but one choice. Maybe this will be their second option.",disgust
"Aw man, I didn't know that the PS5 is gonna be using an M.2 for storage. That shit's sweet! I'm excited for the reveal of the console itself, and I don't even usually touch consoles. Can't wait.",surprise
What they’re referring to is their new SSDs. They claim it allows games access to storage a lot faster.,surprise
"I think the case it was in should get more publicity. I'm not as convinced it would've survived without it. Although, that of course depends what it landed on.",surprise
And yet my wife still manages to crack the glass when dropping in the kitchen with a screen protector,surprise
"The more exciting news is that VImeo is getting more attention from businesses & more funding.

Even though Vimeo's focus is mainly business clients, more competition to YouTube in the video sharing space is best for all of us.",joy
Those sound like the words of someone holding a bunch of Bitcoin and looking for suckers to unload it on.,disgust
"We like to throw around the phrase ""laughed out of court"" a lot these days, but then reality says, ""Hold my beer"" and we get this.",anger
"**TLDR:**  Two lawyers submitted a 10-page legal brief for an airline injury case that contained a bunch of citations to cases that were made up. ChatGPT was used to generate the legal briefing. The judge was pissed that the lawyers didn't proofread it or check it for accuracy and fined them $5,000.",anger
This isn’t news. This has been understood in the crypto community pretty much since NFTs became mainstream,surprise
Haha- they already do. Our greedy corporations went for cheap labor and now crying about IP theft and control ? The G6 countries did a great job at building China economy,anger
"The articles use of the phrase 'global operating system' is super vague. Are they talking about Linux in general as the backbone for nearly all isp's infrastructure? Or cellular OS's like android/ios? Considering that 5G is mentioned specifically, is something of a clue I guess?",surprise
"Can’t help but imagine one of these „huge stockpile of drugs and weapons confiscated“ headlines where the picture shows a bag of weed, a pocket knife and a rusty screwdriver.

I confess! I have copied Dr Zhivago! Three times! And War and Peace! Twice!",surprise
How large was the website’s database? Is it possible someone backed up all the data and can just pop it back open under a new name?,surprise
I guess they were saying the acquisition was more of a bailout? And it was done against the shareholders will?,disgust
FYI to anyone reading this: I've noticed that to run displays through a USB-C port it needs to support alt-mode. We'll also need to look at the version number of the cable and port much like we do with regular USB today.,surprise
"For what it’s worth, I upgraded to Windows 11, but I noticed many programs and websites still see it as Windows 10, so that may factor into the low number.

But also, it’s not a forced update, so there’s that as well.",surprise
"Because Microsoft has made a big mess of this. Two years ago I bought the latest and best-performing Microsoft notebook, and now it doesn't meet the requirements for updating.",disgust
"CCP has been stealing to get to the top for two decades at the very least, look at their military designs lol. So much of it, especially in advanced jet and missile tech is straight copy and paste.",disgust
"""requiring the California Privacy Protection Agency (CPPA) to create and roll out a tool allowing state residents to request that all data brokers delete their information. There are nearly 500 registered data brokers in California.""

Can't wait",surprise
"Simon: I’ve tried to keep my surgery private.

Also Simon: gives first and last name to the world in public news article talking about his “private”  chest reduction surgery. 

Fucking Simon.",anger
"How is this a monopoly? Where were they when disney bought everything, what about the internet companies?",surprise
"He was a buddy of mine from USAFA - we just graduated in 2017. Out of respect for him and his family I’ll withhold his name.

Here’s a toast....",joy
I guess we will let large corporations continue to destroy the world until we hit a point where life is no longer sustainable to the majority of the planet.,disgust
"Trials and errors, praising spaceX with their successful launches and landings but ripping Musk to shreds when there’s some incidental failures - it’s bound to happen and not just once.",anger
NASA is one of the very few federal agencies who are delivering the tax payers money worth. And that's because it's led by a team of scientists and not some scumbag politicians bureaucrats,disgust
"Dude, I’m an engineer, and sometimes I feel pretty “smart” when I solve a weird problem

But nasa engineers are next level man. 

True genius.",surprise
"No, it is not going to go live in 2025. They _might_ turn it on for couple of seconds top, but joint scientific agencies are way ahead",sadness
If it’s actually sustainable fusion then there would be more media coverage of this probably. Fusion energy if achievable is the future of this planets eco friendly energy.,joy
Chinese special agent: Americans watch a lot of porn. Could you filter the porn searched out. 95% of searches filtered out,surprise
"They recently, quietly, laid off a bunch of their employees recently as well. My close friend being one of them. However he has admitted he was being paid $180K to sit on the couch and occasionally chime in at virtual meetings. The severance wasn’t too bad either!",sadness
"$160k as a base cap in Silicon Valley is too low to compete, no doubt about it. Of course, their stock was generous so that helps but people want non-vesting cash too. Explains the price increase of prime.",surprise
"Charter/Spectrum is one garbage ass company.

I feel bad for anyone that works for them or gets any kind of service from the crooked fucks.",disgust
yeah and let’s start with YOU big corps considering YOUR propaganda was made to convince people their share is more important and bigger than EVERYONE of you.,surprise
You want carbon neutral? Then deprecate the lightning cable and change to usb c. Make iphones easier to repair or at least easily replace the battery. Same with the rest of your product line,anger
It’s all the light pollution drawing them to shore when they hatch because they think it’s the moon. So sad.,sadness
"Read a few lines: ""The Sheriff's Office has since spun this off to include students at public schools, presumably to prep kids for a future of pointless harassment by law enforcement officers simply because they have the misfortune of living in Pasco County.""

Sounds about right",disgust
Minority report was scary…the fact it’s starting in Pasco County (my neighbor) is a nightmare scenario.,fear
"What?! You mean it's unhealthy for a human to sit and stare at all the stuff they will never get or achieve, all day?",disgust
"Great, let’s give a bunch of irresponsible corporations our ID’s to be stored insecurely. That’s a great idea.",joy
"Not gonna lie, Australia has some off the WORST takes Ive seen when it comes to technology. Half there legislation seems like it was written by someone who’s last internet experience was through dial up",surprise
"Can see this as a good thing and a bad thing.

Good because it stops 12 year olds from going on tinder, which is something I've seen happen. Not much but still happens.

On the other hand it just incentivises them to collect that data for their own gains.",disgust
Break up big tech. All it takes is three companies to not like your site to erase it. Most people have no idea how much is hosted on Amazon’s servers.,surprise
crypto mining is a giant operation in siberia. oligarchs have been using crypto to avoid sanctions even before crimea was invaded.,anger
Crypto’s value is still tied to government currency. “I have $X worth of crypto” relies on there being an agreed upon conversion between the two. People are buying crypto because of its real dollar value.,surprise
Or we could just not put them through an unnecessarily stressful and harmful life in the first place...,anger
Apple doesn’t want to create two versions of the IPhone so while the transition to eSIM takes place they’ll act as if the American model doesn’t even have it to begin with so eventually when a sizable part of the world has eSIM they’ll be able to use that space,disgust
"I spent $80 on a raspberry pi and an 8-bitDo controller a while back. I put 650 NES games on it, and 275 SNES games on it- and I’m still not tired of it several years later.",surprise
"I keep hearing about how the 5th industrial revolution is merging humans with technology or whatever, but all I can imagine that being like is just how products and customer service are so cheap and bullshitty now but they will be inside our bodies..",surprise
"I mean, if a tech company left a ticking time bomb inside my head and then disappeared without a word or care. I'd be pissed off too.",anger
"You think the 5G conspiracies are nuts and fear the 6G conspiracies? Just wait till someone points out what ""6.6G"" looks like. 

I want it to happen! 😆",fear
I read a story recently that said how it was assumed that this guy died years ago since he hasn’t been seen publicly in years and the family just didn’t want to transfer his empire yet...strange to see an actual confirmation on his passing just a short time after hearing that!,surprise
"Hopefully they don’t use Samsung ice makers to keep him cold before any final ceremonies. 

For those of you with Samsung French-door fridges, you understand.

For the rest of you, never buy a Samsung fridge.",sadness
The other benefit is that you don’t need to bring an oxidizer like you do with chemical rockets... thanks KSP.,joy
Disappointed that this isn’t the one where they set off multiple nuclear explosions and ride their shockwaves to accelerate.,surprise
Wasn’t it GM that did away with all the streetcars too?  Seems GM always comes out ahead on these ideas and the rest of us hold the bag.,surprise
Anyone mind chiming in on what this looks like for Salton Sea residents? We almost bought there because it was so cheap till we read how hazardous the lake is.,disgust
"Looking for an alternate source on this ruling. I am not saying it is false, but the website is operated by a direct competitor of Google Analytics and this is basically one big ad for them.",surprise
"I remember the day Intel announced that they would begin putting individual serial numbers on their CPUs, starting with the Pentium II.

The day Big Brother was born.",surprise
Bing badly needs a rebranding/new name if this is to succeed. Start fresh and ditch the stigma that comes with Bing and I could see this taking off big-time.,sadness
Damn you know I’m high and about to lose it because all I saw was a man curled down in the fetal position ready to cry full of anxiety,fear
First company to get a commercial reactor working will be worth more than several tech companies combined.,surprise
tl;dr he used Roboform to generate a password but Roboform used the date and time as a seed which made the passwords predictable,surprise
"Even more embarrassingly, many of the other countries in the top 10 are developing nations. American ISPS are fucking leeches on society",disgust
