Text,Emotion
This is awesome because they could benefit a lot from the services that 3rd parties provide via Google assistant. Not to mention just being able to use the transcriber if they are in a situation where the other person doesn't understand,surprise
Everyone is talking about how we can’t get to the planet while I’m just here geeking out about the fact that we have the tech to even know it even exists,disgust
"Given the rate of improvement for EVs in the last ten years, I don’t expect combustion engines to be able to compete in another 15.",surprise
">Azure was able to stay online throughout the attack, thanks to its ability to absorb tens of terabits of DDoS attacks.

So it just ""mitigated"" it by having more throughput than the DDOS was able to put out?",surprise
"What annoys me is that I know WHERE I’m going, I just don’t know the NAMES of the streets. I’ve always been like that, but I think it’s bc I’m looking for landmarks rather than a street sign that might not even be there",surprise
"Meanwhile in amerika:

We want access to your banking information because we’d rather look to blame peons for our spending instead of taxing huge corporations.",anger
This is another reason why these behemoth companies should be split up so we can bring back a world of competition. Amazon was supposed to be a book store not commerce-streaming-cloud-cars-everything else kill all business behemoth,anger
"I don't want to give that clickbait a click. Are they talking about Zero Point Energy, like in Stargate, and did this actually happen?",surprise
"This isn't about creating energy out of nothing, it is about transmitting energy via quantum teleportation. Which is interesting, but wont solve any energy generation problems.",surprise
"Pulling energy from somewhere else isn’t from nowhere, click bait title. 

This article or one like it has been posted before and it’s still being click baited. 

There’s never nothing there’s always something.",surprise
Another vapor ware plane that will earn millions in funding only to find the technology hasn’t caught up with the concept and a few top executive will abandon the project after they’ve made a huge pay day leaving investors high and dry.,sadness
Isn’t pretty much every article on hydrogen power clickbait? The problem is getting and storing the hydrogen. This is a logistics problem,surprise
"The linked article is all marketing speak, with no real data.

If they have figured out how to generate electricity with updrafts going up the side of tall buildings, that could be a big deal, but their claims seem too good to be true.",surprise
"Most chip manufacturing sites have multiple fail safes to prevent line down. At least two back up sources of energy, like gas generator and battery. A snow storm and power outage isn’t going to shut them down.",surprise
"I was thinking ""chips - as in Lays Chips"" ... I do eat a lot of chips so my heart skipped a beat for a second.. also those might be closed ;)",surprise
"After seeing so many negative things on the news, I read this and my heart wept with joy.  You are a shining star in the future of the world.  Keep it up!",joy
Anyone else see this picture as kanye west unfurling his chameleon-like tongue to eat a bug off the side of a copier at first? Just me? Ok.,disgust
breath based VOC diagnostic tech has been progressing steadily the last 4-5 years. There will be much more like this.,surprise
How long until people start bashing on these machines for “collecting personal DNA for government use” and saying these are fake machines 🙄,anger
"If I owned a Tesla I wouldn’t use it for Uber, and better yet who would do Uber in a Tesla if you could afford/own a Tesla?",surprise
"I don't understand the argument. I do see Tesla has a lead on EVs. That's clear. How does this make their business any more or less ""zero-sum"" than other maker's business?",surprise
"Tesla is King but are people ok with having the same car as everyone else? I get that’s the point hence Volkswagen or the People’s car but i3, leaf...are all pretty rad",surprise
"> In the fine print, Ford describes the towing stunt as a “one-time short event demonstration” and claims it is “far beyond any production truck’s published capacity.”",surprise
I knew something was up when they stopped stamping passports and started with the thumb/facial scan.,surprise
"> Of the facial data transferred from the MOJ for use by private companies last year as part of this project, around 120 million images were of foreign nationals.

So 70% of the images were of foreign nationals.",surprise
"Dumb question: but in the event we finally figure out fusion, would the Helium byproduct also relieve our helium shortage? Or would the Helium “created” during the fusion process be used to generate power?",disgust
Someone please correct me if I’m wrong as I have no clue what I’m even talking about but what’s the difference between this and gallium?,surprise
"Technically correct since only 31 engines lit, but since that’s enough to reach orbit I’d call it a pretty straight forward success. I doubt they’ll do another static fire before launching, just fix the problems they’ve identified and send it. Probably expect an orbital launch in March.",surprise
"It concentrates them though, so besides the enormous energy cost, we have toxic brine to deal with as well. 
Great that this gets out the nasties, but are they planning a way to deal with effluent?",disgust
"This is cool. CDIFF is THE WORST. Seriously, I lived in a bleached home for almost a year because I got CDIFF.",disgust
"So could rehiring all the cleaning staff that have been let go over the years. It used to be that when you were visiting someone in the hospital, there was always someone cleaning. Now there never is, the floors are filthy.",disgust
"A lot of people here are pointing to a conspiracy or some fallacy in the science field over the headline and didn’t bother to read the article. 

It spits out nonsense.",disgust
"Facebook was supposed to organize relationships.

Instead it spewed misinformation.

I see a pattern here.",disgust
I though this was common knowledge now? The ‘don’t track me’ thing just prevents access to the unique ID of the phone. There’s still a bajillion other ways to do it.. I mean.. you’re probably logged in to their app anyway right…?,surprise
"If this happened in the U.S., the billing against the procedure would likely bankrupt even affluent people and would take years to sort out. Glad the rest of the world continues to advance while we enjoy the best in class service of for-profit medical care.",joy
My local hospital has 3 or 4 of these DaVinci suites now. Pain in the ass to clean but incredible for minimally invasive stuff.,disgust
"We were working on several projects and told the company we were running out of data space. 

Then they fired the three people who told them that fact. 

I sometimes don’t understand how people get high level jobs at tech companies and can barely figure out the work email calendar.",surprise
"This is hardly a new trend. A lot of fast food joints had order taking tablets in the lobby in 2018 or 2019. 

Voice assistant order takers seem sensible.",surprise
"Lets hope machines start making fast food cause people need to wash their damn hands. After working at Papa Johns for 3 years, i don’t trust anyone jn the food industry to be sanitary unless its some 5 star restaurant and even then…",disgust
"Check your local ISP. Sparklight in Idaho dropped prices, removed data caps and increased speed the day this was available for preorder",surprise
"This is actually a game changer? Once all the satellites are launched you can live anywhere in the world and get decent internet, you could live in a dream home in the mountains and be fully connected to the world, and likely will only improve over time.",surprise
"PreOrdered. As a rural customer currently paying $170 for 2Mbps and phone, I’m hoping I will get it sooner than later.",surprise
One Doctor started off by saying “Well it was a pig heart so..ya know? Like I feel that was miss one…”,sadness
r/suspiciousquotes material with that title. Also just finished ep 7 of Squid Game so this concept is extra interesting to see on here,fear
"Crazy they have all the time to launch websites and warn people, none of the time to declare a climate emergency and take action against industry.",surprise
Emergency medicine in space? Replacing a bone on space? Where? With what? Who? Or it’s created in space for emergencies on earth.,surprise
"Thanks!  I read the article and learned how different types of heat pumps work! 

Regarding *Knowable Magazine*, I’ve never heard of them before.  Thanks for turning me on to it!",joy
Sounds like they didn't have a policy in place where they disabled people's work accounts when they left the company. Should be pretty standard shit to do...,disgust
"They may spend that amount , but I can bet it is all a smoke screen. It looks good for auditors , but in practice , I bet there are gigantic holes in their infra. I have worked in IT at banks and insurance companies . This is all for show.",disgust
So now they want to charge money so that we get the privilege of training their AI for them?  What happened to 'dont be evil'?,surprise
Google charging for recaptcha may be some of the best news I’ve heard in a while.￼ Good fucking riddance.,joy
">	Both founders are selling under pre-filed trading plans. Brin and Page had previously sold shares in 2017, when their last plan expired.

Cool, so not news",surprise
"High level execs at big public companies don’t log into their brokerage account and just decide to sell $1B of stock out of the blue. 

It’s all automated, board approved, and managed by accountants and legal teams.",surprise
">Not News

&#x200B;

>Literally the end of the world

&#x200B;

The initial comments on this post are a great example of the destructive power of social media, and how disinformation gets started

:\\",anger
"Reddit disguises ads the same way as TikTok, it appears as a post that sometimes you can comment on.",surprise
"I feel like nobody here even read the article.

It literally says that what Tiktok is doing isn’t some weird uncommon thing.",disgust
Been using ours in Cornwall for the last couple weeks and it’s been solid! Hopefully this gives us a speed boost 😬,joy
"I want expanded service in the US, starlink has the best bandwidth/no data cap out of the 3 providers in my neighborhood but they are already completely booked out for the year.",sadness
So I’ll still be able to jerk off after obi wan de limbs me and leaves in the fires of mustafar? Right on.,anger
I wish I hadn’t deleted my YouTube content and account from the early 2000’s. I’d like to see it again,sadness
"If I remember correctly, the whole thing use 10x less « fuel » than a single car for the same travel distance.",surprise
I noticed that some big chains have installed face recog into their self- check registers. Perfect for collecting complete persona in one setting if you use a credit card. Even more if you use a bank issued debit card.,surprise
"Of course. If we have the ability and technology to do it, we’re going to do it. There’s no way around it. Never before in the history of the world has anybody said, “This technology goes too far, we should just scrap it.” If the new technology violates the laws, we’ll just rewrite the laws.",anger
If they could find a way to fix Crohn’s disease without removing my bowels that would be really cool.,joy
"When we make a synthetic electronic brain and integrate it with our own we’ll be able to migrate our consciousness onto a medium that can live forever, go into standby, and explore the universe. Not to mention duplicate.",surprise
"Necrobots...!

Why is it that when scientists come up with names for this, they sound infinitely more disturbing than what the best horror writers come up with?",fear
Eli5: why does it make more sense to transport airplane parts between factories for assembly using this thing rather than do it all in one location and then fly the final product to its customer?,surprise
Why would you give your oppressed people access to all the information in the world. It’s tough to control what your subjects digest. They wouldn’t want revolutions,anger
"Headline is terrible, but the article, interestingly, points out that India and Brazil aren't in the pledge neither. Nor are Nigeria, the Philippines and Turkey. Which means this pledge is basically for a minority of all people on earth.",disgust
"PAWS - Protection Assistant for Wildlife Security

I was thinking Protecting Animals With Science, but I guess that’s cool too.",joy
"They're only hurting themselves when they pick the fruit too early like this. When Google and other places like FitBit do these stunts, it just discourages me further from being an early tech adopter. Less early adopters = less likely to be a mainstream thing, aka ""a flop"".",disgust
"Wish this had been developed a few years earlier, for my mom, but glad some good progress is being made.",joy
"We’re all well into a psyop. Wouldn’t be surprised if a lot of conflicting info comes in today. 

Oh wait RU is pulling troops from the border while simultaneously positioning for attack.

Hmm 🤔",surprise
We should just expect this no matter what happens in Ukraine. They’ve been at it for years and it’s just rational that it’s be stepped up when tensions are high.,anger
"Tl;dr: 

It’s still liquid and not solid state so it has performance characteristics between lithium ion and solid state. It’s not going to go into personal portable electronics or cars but is focused on electric aviation which isn’t sensitive to cost right now.",surprise
"I remember watching something on true lithium-metal batteries a few years back, it’s cool to see that some progress towards their use is being made.",joy
"We’ll see how well these work once people start shitting, pissing and puking in them. Regardless of cameras, the idea that someone isn’t immediately there to admonish you for being disgusting will definitely be an issue.",disgust
"Is it still considered a startup if Amazon, one of the largest tech companies in the world is helming it??",surprise
The reason they use this specific application is because of the energy density of hydrogen fuel cells compared to lithium ion. To everyone shooting this idea down this is actually a brilliant application because on a drone the energy density is incredibly important on a flying machine.,joy
"One of the friend groups recently decided to boycott Facebook, so they made a group chat where they shared the link on FACEBOOK to invite people to collectively delete their accounts at 12 AM. 

The group chat was on WhatsApp.",anger
"Confounding scenario:

If someone were to have neurotech installed, and then that neurotech alters their normal response to events, has their consent been overridden by the neurotech or has consent been manufactured?

Is manufactured consent the same as normal consent?",surprise
"Slack is cool, it takes your cluttered and unreadable outlook mailbox and replaces it with a a cluttered and unreadable slack window with gifs",sadness
"Welp, there goes Slack as a common tech worker tool. Once Sales gets ahold of it, the tech teams will leave in droves.",surprise
I’m in a rural area and have been racked over the coals with poor service for high cost and this service will become a life saver . Having said that there is a feeling that the shoe is hovering or that we might be creating sneedsville from the Lorax .,fear
I pray for the day fusion is viable. I pray for the day fusion energy runs carbon capture equipment to dampen the effects of climate change. I pray to see this in my life time.,sadness
"Serious question, is it an act of war for NATO countries to supply Ukraine with data?

If not, why are we not doing this? We should be giving everything we can to Ukraine.",anger
I did Doordash and they almost had me. I got call right after I dropped off at shady location. They wanted my info and I hanged up.,anger
Just burn the company down.  Christ it was founded on some virgin’s idea of indexing women at college: it hasn’t improved its moral stance since then.,disgust
I put mine on my cat who like to go out. Really good alternative to cellular devices that needs to be recharged frequently and wayyy cheaper. Has alerted me a few times when she went really far and people passed by her on their walks.,surprise
someone stole my purse and tossed it out of their car on the highway. we were able to find my purse and  a half dozen other wallets on the side of the road thanks to the air tag.,anger
"i dont care bout info collecting, but i still rather have better dumb tv spending costs on picture quality and just buy a shield.",sadness
Imagining the bros in my neighborhood flying these around and they’re modified to be as loud as possible and with huge bass amps,surprise
"I was fully expecting to read things like “Lightning is triggered by political talk or religious debates…”

I need to get off the internet for awhile.",surprise
"Ooh. Maybe some transcription factors will finally have their functions explored! 

Got to see the paper though. I’m fairly excited about this.",joy
"All this big Corp mergers ffs someone’s gotta stop the merges it’s like every week heavy tech companies are dropping there bluffs
     

  Do I need to put the /s?",surprise
Looks like we can blame a lot of bullshit on people not being able to hang loose on the gravity waves.,disgust
"Lol this is not a reputable source, but complete backwards compatibility is the only thing that would get me to upgrade in a timely manner.",surprise
">However, the powerful backward compatibility feature of the PlayStation 5 will remain nothing more than a rumor until Sony officially confirms it.

FFS, what a waste of an article",disgust
"New meaning to the tagline, “Straight outta Compton!”   This is cool, and the future implications to this for plant growth in fully controlled environments is neat.  I’m dreaming of spaceships with giant growing areas like this.  The Expanse-like.",joy
"\>Plenty's greens are now available at Bristol Farms, Whole Foods Market stores and local grocers in Compton.",joy
"30% they hired comes from the city of Compton.  Not all of them.  I think its really important to hold them to it for the future.  I’m excited about vertical farming with less space and no pesticides, but the next tackle would be biodegradable containers to sell the greens in.",joy
Sounds like how the OnePlus 7 pro would retract the pop up selfie cam when it detected that it was falling.,surprise
Apple knows there’s an entire generation that has missed out on the joy of the “slam shut-hang up” power move.,sadness
"So it clears out proteins, the IV therapy they have does this now, but doesn’t impact the clinical symptoms. What is different here?",disgust
"This is amazing news, especially for underdeveloped countries, but for us domestics, hopefully this brings the price of MRIs down.

Edit: Okay I get it, new technology news has a lot of specifics, but this is a step in the right direction.",surprise
"Seems to have a fair number of drawbacks, but maybe this is the start of more portable MRIs and other medical imaging equipment.",surprise
"According to the article, “New” means “earliest possible stages, and not nearly ready for public deployment”.",fear
ELI5 - can power not be generated without steam turbines? I always wonder why something futuristic like Fusion Tech would use 19th century tech to convert from heat/steam to mechanical to electricity.,surprise
"Three years ago the construction industry said this was stupid and would never work so stop trying. Same thing two years ago and a couple months ago, and just recently. 

But here we are, one step closer to making the world a better place.",surprise
"This is so cool! I’m in my 50’s. If you had told me 30 years ago that this is what the future would bring I would have said “Very funny, I suppose we will also be walking around with little computers in our pockets”.  Mind boggling how far technology has come.",surprise
"Or course it is. Most of the time I don’t even understand what you are saying, how do you expect me to read your lips.",anger
It is misleading to use Robots to depict AI. Not all robots would run AI-powered software.  Lip reading software just needs a camera so even a mobile phone or a laptop could be used to depict the technology on which such software would run.,disgust
“The problem is it’s impossible to build a tool that is designed to track down stolen items without also building the perfect tool for stalking.”,fear
"Decades ago in Brazil, my dad had his car stolen, and a few days later, while riding the bus in Rio, spotted a car like his parked, gets out of the bus, confirms it was his stolen car, and takes it back. 

I would pay top $ to see that ass**** thief’s reaction.",surprise
As someone who had a spinal fusion at age 14 in 2004... this makes me feel more hopeful for continued care in the future 😊,joy
"Yeah, I never know what masks to buy from Amazon anymore. The first 10 brands are “sponsored” and then amazons “top pick”. Makes me think all those assholes just paid Amazon money to be top results. I don’t even know if I can trust star ratings",disgust
"Unlike Walmart, Target, Macy’s, Pennies, Marshall’s, Home Depot, Lowe’s, every grocery store, every single Sears store in existence, and every retailer that has ever existed???",surprise
For once retail workers get a break when corporate doesn’t. Corporate still has to work from home when retail staff can take it easy and get paid.,anger
"Let me retitle that for you

“Military grade drone surveillance technology made cheap enough for standard police use.  Big brother now possible”",surprise
"I drive only Hondas (I have 3) and I only play PlayStation (have a 2, 3, 4 and 5) this makes me excited. I’ll buy one!",joy
"It isn't wrong, but the reason it's saying these things purely has to do with the sentiments expressed in the training data set. Just ironic that they didn't filter the dataset to remove biases against their own company.",surprise
"SafeGraph will stop selling that data because they got caught.


Fuck these people.


BURN. IT. DOWN.",anger
"Operator error. 

AKA 30,000 morons who click buttons without reading, installed a new version of “flash player”. People think that 30,000 is some significant number lul

Computers don’t just magically install malware by themselves.

# Hey thanks for the gold, yo. And the silver, yo.",surprise
"So is physiognomy going to be a thing again now?

Because I’m seeing all sorts of articles about how your facial features can tell your sexuality, political leanings and mental disorders.",surprise
"There's a disturbing theory that Google has already enabled or tested this form of censorship already within Google searches and viewable YouTube subscription videos. Highly doubtful, but still kinda weird to think about. The what if.",disgust
"This country is going to come to a painful, grinding halt when the internet someday goes down for an extended period of time.   And you thought the toilet paper thing was bad.",sadness
This is more on Android allowing access to the MAC address than it is on an app in getting it.  They may have used some legacy method that wasn't patched.,surprise
"Why do people still love this company? For all the shit Facebook gets, tiktok is just as bad and people love tiktok.",disgust
"As someone who’s iPhone only charges if the lightning cable is inserted “just so,” I endorse this message.

Edit: thanks for the tech tips. Port is clean, does not work well. Can’t wait for usb-C.",sadness
The senators are only doing this because the EU has already passed this which will force Apple to switch anyway. Now the polititcians can pretend they did something while ignoring real issues.,anger
Nothing in China is “private”.  It is all state sponsored or dual use for their military.  They aren’t a free nation at all.  Can’t view China under a western civilization lens.  That’s how they win,fear
DuckDuckGo's value proposition has always been that they do not track users and are thus not able to put users in filter bubbles. That's all still true.,disgust
"If you think that this is censorship then you didn't really believe in DDG's ""mission"" to begin with. Ranking is a required part of the search engine experience for your searches to have any meaning at all. They have always and will always rank the results. Downranking != Censorship.",disgust
Perhaps state and federal govt should start requiring that software for infrastructure projects be certified for security and the installations be audited on a regular basis for security best practices.,anger
"Is it safe to assume this is partially due to Hyundai acquiring Boston Dynamics? 

I understand this is normal development as they want Atlas to improve in all functions, but I can see how a robot that’s able to perform construction tasks will help Hyundai in their line of many businesses.",surprise
"It's not even funny lol, it's like a bad Photoshop. On the other hand, this quality corroborates really well with the other post stating that Russia's AI capabilities plunged.",disgust
I was kinda hoping for the Conan O’Brien style skit that’s just picture with a hole cut out of the mouth.,surprise
They are hiring like crazy. I’m an automotive engineer and they hired 5 of my friends in the past few months. No idea how they’re planning to keep that payroll going.,surprise
